{
  "apiVersion": "hosting.lowerduckpond.net/v1alpha1",
  "kind": "TenantObservedState",
  "tenantId": "0191e2c4-8f7a-7c3b-8d1e-5f62047a2100",
  "desiredManifestDigest": {
    "format": "lowerduckpond-manifest-v1",
    "algorithm": "sha256",
    "value": "bbbbbbbbbbbbbbbbbbbbbbbbbbbbbbbbbbbbbbbbbbbbbbbbbbbbbbbbbbbbbbbb"
  },
  "observedState": "active",
  "activeDeploymentId": "0191e2ca-49f2-7608-8cf3-f80ab2cab151",
  "runtimeGenerationId": "0198d17f-6f4a-7000-8000-000000000004",
  "reconciledAt": "2026-08-29T12:01:00Z"
}
